start_time,end_time,text
1027.982,1030.668,I feel like I'm seeing a whole another level
1030.668,1032.283,of spirituality
1032.283,1034.599,"Oh no , don't wipe your eyes."
1034.599,1035.851,Well.
1035.851,1037.112,Starting to get full.
1037.112,1037.945,I'm full too.
1037.945,1038.794,I'm really full.
1038.794,1039.627,I'm not full.
1039.627,1041.293,"See, I wish I wish you had my stomach"
1041.293,1042.126,and I have your mouth.
1042.126,1043.792,"Oh no. now we would just be both be it,"
1043.792,1045.542,it would be mixed up.
1046.985,1049.73,"I'm really, really, not doing good."
1049.73,1052.251,I'm debating whether to finish or not.
1052.251,1054.052,I don't know if I can.
1054.052,1054.97,I'm officially tapping out.
1057.992,1059.436,As Zack advised I'm gonna quit.
1059.436,1060.584,I think I did pretty good.
1060.584,1061.417,You did well.
1061.417,1062.547,You've been amazing.
1062.547,1063.683,I can't anymore.
1063.683,1064.516,"Wow, way to go."
1064.516,1065.349,Way to go Alexandria.
1065.349,1066.182,I will say
1066.182,1067.596,what is limiting me right now
1067.596,1069.877,is my stomach volume.
1069.877,1074.02,So I am going to take a pinch of the ghost pepper.
1074.02,1074.899,What?
1074.899,1075.732,And count...
1076.565,1077.81,"No, Ned."
1077.81,1080.736,I'm making my own challenge YB.
1080.736,1081.784,Ned loves bad ideas.
1081.784,1083.953,Don't use your fingers.
1083.953,1085.674,Oh my god.
1085.674,1086.507,"Yes, yes Ned."
1086.507,1087.723,Don't back down now.
1090.249,1091.216,Oh my god.
1097.669,1099.169,What do you see?
1103.641,1105.264,I wanna get further away.
1106.574,1107.878,Euphoria!
1110.616,1112.993,I feel like I'm looking through
1112.993,1114.804,a kaleidoscope right now.
1114.804,1118.284,My entire vision is just doing this.
1118.284,1119.601,"Click, click."
1121.226,1123.559,I'll have what I'm having.
1124.44,1125.362,Are you gonna finish it?
1125.362,1127.397,I have to beat YB. Don't know if she's gonna be
1127.397,1128.442,at the same place as me.
1128.442,1130.996,I just died. But if I finish this that means YB has to
1130.996,1132.042,finish the whole bowl.
1132.042,1133.573,You can do it YB.
1133.573,1135.141,We believe in you.
1135.141,1136.205,"Wow, wow."
1136.205,1138.137,"You're a hero, you're a hero."
1138.137,1139.501,Show us what you got.
1139.501,1141.809,"YB, this is for you."
1141.809,1144.091,"Go Eugene, go."
1147.391,1148.224,I'm done.
1148.224,1149.057,Okay.
1149.057,1149.89,There's no more noodles.
1149.89,1150.723,Alright.
1151.923,1153.582,"Look at him, look at him."
1153.582,1155.619,"Eugene, YB and Ned all surpassed"
1155.619,1157.042,all expectations.
1157.042,1159.112,Ned did exactly what we thought he'd do
1159.112,1160.912,though with making a terrible decision.
1161.89,1162.723,I don't like
1162.723,1166.069,I just run a marathon and made love
1166.069,1167.367,at the same time.
1167.367,1169.95,Like I need cigarette and I don't smoke.
1169.95,1171.316,"Well, I'm proud of us."
1171.316,1174.103,All of us got passed level five.
1174.103,1175.016,Yeah.
1175.016,1176.748,Zendaya is me.
1176.748,1179.151,And you have reached chi.
1179.151,1180.447,Bravo to the team at Killer Noodle.
1180.447,1183.115,You guys have made a spectacular product.
1183.115,1184.434,There's some in here for everybody.
1184.434,1187.227,"It truly is painful, delicious,"
1187.227,1188.06,and spicy.
1195.55,1196.913,That is equilibrium.
1196.913,1198.266,Everything is Math.
1198.266,1200.023,A perfect amount of both spices.
1200.023,1202.082,"The stinging spice, the numbing spice."
1202.082,1202.915,Ah.
