start_time,end_time,words
1440,1460,"lot more lit than my school dances . My school dance was terrible . It 's the next day and the dance was so fun . The dance was crazy . We were jumping in a mosh pit . Comment down below if you 've ever gone to prom . I feel like everyone needs to go and get the prom experience . So fun . My friend Payton , now she flew somebody out so she could go to prom with them , which I think is really"
1460,1480,"sweet . So , she might go to number two . Uh , move these people down . I 'm sorry , but guys , that was really sweet . Paint , I miss you , but let 's do this . I do n't know how to spend this much money . It 's hard to think about . Jim is 17 . I met him from when we did a video in his school , and he was one of the classmates , and he 's really nice . So , let 's see if he does something generous ,"
1480,1500,"something funny , and creative . Let 's go get some energy drinks . So , we went to CVS and go to Celsius . I mean , energy , that 's fun . I did n't got like so many Celsiuses . So , I stole one of his Celsiuses and I gave it to my friends and I was really nice and they were really happy . So , get Celsius , give it to your friends because it 's really nice . Kids do n't drink Celsius if you"
1500,1520,"'re under what , like 15 , right ? Like Sailor does n't drink Celsius . So , that 's good . So , I got my energy drink right here . And I was thinking about it . There 's a lot of things we could do with this money . We might as well do some charitable things with it . There 's a great paw shelter nearby . And I figured we could get some stuff for them . So , now we 're here in the dog aisle and there 's a list that they have . Now we 're just going to fill it out . Wait , he 's"
1520,1540,"in like a pet store and everyone was just in a pet store . So maybe they 're doing the same thing for puppies . Last one . He 's getting a lot of pet food . So now we got the cat food and dog food . Now it 's on the way to the shelter . We spent $ 136 , which means"
1540,1560,"that there 's still a lot of money left . They spent $ 136 and they have a lot of money that they can spend . So , let 's see if we spend it on anything else . Now , we 're finally here at the Paw Shelter . Let 's drop off our goods . Oh , they 're dropping it off to a shelter"
1560,1580,"just like Emry did . That 's so cute . Oh , make sure to check out your local animal shelter and help them out when you can . A Gio donated animals , too . Okay , this is that 's going to be a tough choice for her . We 's already up high on the leaderboard . Now I have to put Gio there , too . But spending money makes you really ,"
1580,1600,"really , really hungry . You can go Shake Shack , a burger . I mean , okay . Yeah , I was thinking about it . What 's another way to go spend money ? Concert tickets , cuz they 're kind of expensive and it 's a great way to get an experience out of it . Since there 's this great band playing soon , called the Maria , I will get tickets . And I 'm super excited . Oh , he 's going to a"
1600,1620,"concert , so he 's getting an outfit . Every good concert needs a good outfit . Okay , that looks tough . I got a bunch of stuff from Levis 's and Tilly 's . So , last step , getting tickets . I did it . I had successfully completed your challenge ,"
1620,1640,"Jordan . There it is . And now I can enjoy Jordan . There it is . And now I can enjoy it . So , first he was generous and now he 's having fun . He 's got two out of three . He went to a concert , so that 's really fun . And he got stuff for pets and that 's really cute . I got a burger and a Celsius . Gio also has to be number one . So , he also gets to be number one . Sus , you have to pick"
1640,1660,"one person . Number one , I know . So , you one person . Number one , I know . So , you just going to It 's like half the board . We 'll see . We 'll see . I think I 'm pretty much broke , but okay . There 's only one more . This has been rough . Hi , Legend . It 's the North Nuts . Okay , that was Saki and she 's with the Norris Nuts and she 's really sweet . I met them at the Kids Choice Awards and they were all really nice . So , let 's see"
1660,1680,"what they buy . Guys , I think what we need to do is go to the pet store and buy a cat . Oh , they 're going to the pet store and buy a cat . Do you think Sally is more of a cat girl or a dog girl ? Look at this cute definitely a dog . S you 're a dog person , are n't you ? Hey , Dad . Can we go to a dog shelter and buy a dog ? Not yet . Okay . Oh my god , Biggiey 's holding him . Guys , it 's"
1680,1700,"so cute . We have six kids and two dogs . We 've got nothing . We need more . The cat 's falling in love with Biggie . Legends . I wish I would have got that cat . And plus , I 'm not the one spending money cuz I 'm not 18 . Sockie is . Well , I guess they did n't get the cat . This is where I 'm spending my money first at a very futuristic sushi place . They even have like a train on the"
1700,1720,"tracks . How cool . When we were in Singapore , we went to sushi restaurant and they had like a train thing and this kid was putting his hands in it before like it got delivered to the person . It was really funny . E. Yeah . I am planning to spend $ 100 on this sushi train and we 're going to help us spend it . My first plate of sushi is this chicken katsu . Sabre has literally"
1720,1740,"gotten a volcano of sushi . Yeah , that 's good . That That 's so sweet that they 're doing things as a family and they 're all together . We are also going to get a dessert . Do you want to matter you 're going bankrupt ? We 're getting chocolate by the bald man . Is it like I love spending other people 's money . It 's so"
1740,1760,"fun . If you ever won , we can always do like an entire video of spending like maybe all your money . I was thinking maxing out Jordan Madd 's credit card . If this video gets 10 likes , would do that video . You 're from Australia and I just learned a lot about Australia . It 's hot there and I forget everything else . All right , mate ."
1760,1780,"Okay , now it 's time to spend my money on something I really , really want . The Apple Store . Oh , now they 're at the Apple store . We should watch some Jordan Matter on the iPads . Subscribe to Jordan Matter . Oh , and they subscribed to Jordan Matter . They did n't subscribe to Sish Matter . How did I lose a point ? I 'm going to buy some"
1780,1800,"AirPods . AirPods . I just got the AirPods . Funny story . The reason why I need these is that I had AirPods and I dropped them down the stairs . So , I 'm so happy Jord gave me so I did n't have to spend my own money . So , thank you guys . God , this is getting expensive . All right , guys . They just got AirPods . Please pick us for the"
1800,1820,Please knuckles . Saki was really sweet because she hung out with all of like her family and they all did things together which is fun and generous that she let her family come . So maybe I 'll put that at number five . Now I have to make a
1820,1840,"decision . And before I pick my winner , I want to show you guys what 's inside the mystery box . Thank you so much . What 's in it is $ 5,000 . That 's more money than I ever thought I could see . Look at this . What ? 5,000 . Oh jeez . Oh , okay . Oh , wait . Give us my money . It 's my money . Look at that . There 's so much"
1840,1860,"money in here . Now , we got to go pick our winner . And whoever wins gets the $ 5,000 . So , do n't parasailing sounds so fun with him . But that 's kind of selfish . So , I 'm just going to put him right here . But I really want to go parasailing with him because that sounds so fun . But I do n't want to be selfish . So , he 'll go in number eight . Mila donated to the Boys and Girls"
1860,1880,"Club . Embry and Gio donated to a animal shelter . They were so generous and they had so much fun . I think all three of them donated to charity . So , I 'm going to split the prize up and donate to the same charities . Oh , actually , that 's really nice . Wait , but $ 5,000 though ? Yeah , you 'll be okay . Okay , it 's"
1880,1900,for charity .
