start_time,end_time,text
0.24,2.3890000000000002,"Today, my daughter Salish gives her"
2.399,5.749,"credit card to ages 1 through 18. Wait,"
5.759,7.749,"no, we're using your credit card. What?"
7.759,9.35,"No, we always do. Let's use yours this"
9.36,13.43,"time. Oh, no. And yours is unlimited."
13.44,15.91,"Today, my daughter Salish gives my"
15.92,18.63,unlimited credit card to YouTubers aged
18.64,21.75,1 through 18 to see how they spend their
21.76,23.91,money. I will watch each influencer and
23.92,25.83,decide who spends their money the best.
25.84,28.15,The winner will get whatever is in this
28.16,30.47,mystery box. Mr. security guard. Can you
30.48,32.069,please make sure that nobody touches
32.079,34.59,what's inside that box? It's really
34.6,37.51,"valuable. Okay, thank you. It seems like"
37.52,39.59,all of my friends are really good at
39.6,41.43,spending my dad's money. I guess they
41.44,43.43,learned that from me. And I don't know
43.44,45.75,if my dad is ready for that because they
45.76,48.15,have some crazy ideas planned for my
48.16,51.029,"dad's credit. Starting with age one,"
51.039,53.75,Ocean Ortiz from Familio Diamond. I'm at
53.76,55.189,"Target with my one-year-old brother,"
55.199,56.709,"Ocean, and we're going to be buying"
56.719,61.069,whatever he touches. Item number one.
61.079,65.75,Okay. He's so cute. This is $40.
65.76,68.59,Oh my gosh. She's spending $40 on a
68.6,71.51,toy. I knew it. I knew I got the right
74.159,75.91,He's spending so much money. It hasn't
75.92,78.55,even been like a minute. Enough toy
78.56,80.07,shopping. Now it's time for Ocean to
80.08,82.39,pick himself an outfit. He's so cute. We
82.4,83.91,"found the perfect outfit, guys. And he's"
83.92,86.469,"running again. Wait, that looks exactly"
86.479,88.55,"like what my dad wore. Wait, what video"
88.56,90.469,"is that? No rules. Okay. Yeah, he looked"
90.479,92.069,really stupid. But I bet Ocean would
92.079,93.83,look really cute. He's walking like he
93.84,95.19,knows where he's going. He's going back
95.2,96.63,"to the toy section, which is good"
96.64,98.31,because that's the most expensive
98.32,100.23,"section, so he knows what he's doing. He"
100.24,102.069,"really likes this toy. Oh, this one,"
102.079,105.27,"too. Okay, that's $40. I'm glad it's not"
105.28,107.35,my credit card.
107.36,109.91,"All right. No, Dad. Ocean is spending so"
109.92,111.19,much of your money. How much money is
111.2,112.789,"you spending? Oh, Dad. This is my thing,"
112.799,114.55,Dad. I can't watch. Let me watch. It's
114.56,117.35,my money. It's my money.
117.36,119.67,It's not going to fit.
119.68,122.069,We have spent $500 and safe to say he
122.079,124.23,"had the best day of his life. Yeah, they"
124.24,126.87,for sure spent $500 and he looks so
126.88,128.79,happy. I'm going to use this board to
128.8,131.11,rank who spends the money the best and
131.12,133.03,whoever ends up at number one will get
133.04,135.03,"the mystery prize. So, what's in this"
135.04,137.43,"actually? Oh, what? I just want to look"
137.44,139.83,"at it. No, hold on. Is that my money"
139.84,141.75,"that we use for that? Uh, I don't know"
141.76,143.75,if it's my I spent it. Let me look. I
143.76,145.91,want to see. You mean I just want to see
145.92,148.63,the I just
148.64,152.83,"Okay, I"
152.84,154.869,"understand. Okay, you're right. You're"
154.879,156.229,right. How are you going to decide who
156.239,157.99,spends their money the best? That's so
158.0,159.99,"subjective. Well, I'm basing it on three"
160.0,162.39,"things. Generosity, fun, and creativity."
162.4,163.83,"So, I think this is going to go at"
163.84,165.35,probably number one cuz it's the only
165.36,167.27,"one I have. Oh, and he looks really cute"
167.28,168.949,and he looks like he had a lot of fun.
168.959,170.47,Okay. All right. Bye. Are they all going
170.48,172.229,to spend that much money or I don't
172.239,173.67,know. We'll see. Maybe a little more
173.68,176.47,next time.
176.48,178.79,"Oh, it's me. So, we are in front of"
178.8,181.83,Target and Jordan and Taylor got me more
181.84,184.309,"than I expected. She's so cute. Okay,"
184.319,185.91,let's see what she spends her money on.
185.92,188.07,My money. I didn't pay his money. I have
188.08,190.39,"a plan, but I want to let you guys just"
190.4,192.63,now. Okay. Is that your first item? Did
192.64,194.07,you check how much it is? I don't really
194.08,195.27,"care how much it is. Like, it's"
195.28,197.35,"basically unlimited money, right? Yeah,"
197.36,200.47,it is unlimited. I love these. Do you
200.48,203.589,even have a phone? What? How do you get
203.599,205.589,this for your phone? She's buying phone
205.599,207.35,cases and she doesn't even have a phone.
207.36,208.71,She's really trying to waste his money.
208.72,210.55,I like her. We're in the sports section.
210.56,213.03,"Hey, you don't play basketball, though."
213.04,214.789,"Okay. Well, I guess she's going to be"
214.799,216.55,playing a lot of new sports. That's
216.56,221.35,actually a soccer ball now.
221.36,222.949,We're going to get some Uno cards.
222.959,226.869,$4.99. Oh my god. Oh my god. Why are you
226.879,228.789,buying that many toys? She's dropping
228.799,230.71,all of the toys. This is all like boy
230.72,232.39,"toys. Why are you getting them? Yeah,"
232.4,233.75,you're pretty right. I should get some
233.76,235.19,girl toys. She's just getting a lot of
235.2,236.63,stuff that she's probably not even going
236.64,238.63,"to use. Salish. Dude, are you Can you"
238.64,239.91,talk to this person? They're my Door
239.92,241.589,Dash person. What am I supposed to do?
241.599,243.83,Just do whatever like they're asking.
243.84,245.429,I'm getting your Door Dash while you're
245.439,247.27,spending my money. This better be on
247.28,248.949,"your account, Salish. It better be. It"
248.959,250.869,is. I swear. I got didn't have fun
250.879,252.229,because I had a credit card for
252.239,253.91,"Postmate. Or wait, what? I had a gift"
253.92,255.91,card for Postmates and I got the
255.92,257.99,cucumber salad and the spicy noodles.
258.0,260.069,That sounds so good right now. What' you
260.079,261.83,get for me? I didn't get anything for
261.84,264.629,"you. Moving on. Yeah, let's go. Yeah,"
264.639,266.629,let's go back to spending my money. Like
266.639,268.469,your two friends who are about to do the
268.479,270.23,"most dangerous things they can imagine,"
270.24,272.469,like Nadal paragliding and Paisley
272.479,274.469,bungee jumping. And I'm the one paying
274.479,276.71,"for this madness. Oh god, this is going"
276.72,279.03,to be expensive. What is this turtle? I
279.04,280.95,"like turtles, too. Sometimes I act like"
280.96,282.87,the turtle cuz sometimes I'm slow cuz I
282.88,286.79,love bed.
286.8,289.03,I think I've seen her laugh 100 times in
289.04,295.59,"his YouTube videos. He's like,"
295.6,298.07,"she got so many things. Hey, Mimi, I"
298.08,300.23,think you overdid. I always wondered if
300.24,301.59,they're going to sell a pink Spider-Man.
301.6,303.59,"Ma, you don't even like Spider-Man. What"
303.6,305.749,"are you doing? Okay. By the way,"
305.759,307.749,"Annazala family started this trend, but"
307.759,309.51,if they had told me how expensive it
309.52,311.749,"would be, I never would have done it."
311.759,313.83,This is fun. I'll get both of them then.
313.84,315.029,I don't know you like that. What's going
315.039,316.95,on? It's not for me. Just a reminder.
316.96,318.95,Got a little hint. What do you mean it's
318.96,320.629,not for you? Don't worry about that
320.639,324.629,right now. Ta.
324.639,326.469,What should I do with all of it? I
326.479,329.27,always wanted to get the USA champion
329.28,331.51,"chips. Oh, does that mean I get to get a"
331.52,334.15,nacho chip after this? Cuz it's called a
334.16,336.469,"world record chip. It's a championship,"
336.479,340.95,"not a chip. Oh my god. Okay, we're not."
340.96,342.31,Tell me the truth. How much sugar did
342.32,343.99,you have today? had two pancakes in my
344.0,346.39,school for breakfast and some sausage
346.4,350.31,and two cups of syrup.
350.32,353.67,"Oh my gosh, my food. Yay. Thank you,"
353.68,356.15,Dad. You're ridiculous.
356.16,357.909,"Guys, my food is here. In case you're"
357.919,358.95,wondering what it's like to film with
358.96,360.629,Salish. There you go. Do you want any of
360.639,363.83,"my food? Okay, I guess not. Anyways,"
363.84,366.43,this is what I got. Here's a
366.44,369.11,mukbang. I'm so gassed. If anyone knows
369.12,371.029,"what this thing is, that white thing,"
371.039,372.79,"could you tell me? S, you want to try"
372.8,374.71,using the chopsticks in the proper way?
374.72,375.909,I think you're supposed to like take
375.919,377.51,"them apart, but I don't do that."
377.52,379.43,"Anyways, let's get back onto our video."
379.44,381.27,"Mimi, this is way too much. I don't know"
381.28,382.55,you like that. You don't know. You're
382.56,384.15,going to be proud of me after. Are we
384.16,385.909,"going to tweet or No, we're done. Let's"
385.919,388.23,go check out.
388.24,389.909,"Oh my gosh, guys. They're checking out"
389.919,391.83,right now. And that employee probably
391.84,393.59,thinks they're crazy. They have so much
393.6,396.07,stuff. Let's see.
396.08,398.87,"Oh my god, this is so exciting. Your"
398.88,400.79,"plan better be a good plan. Don't worry,"
400.8,403.189,Daddy. Oh my god. Do we have all these
403.199,406.309,left? 409.
406.319,411.27,"409. What? I mean 1,000. What? Okay. I I"
411.28,412.87,"can't watch, Colin. I can't watch. It"
412.88,415.029,"went to 10,000. Okay, now you're messing"
415.039,418.07,"with me. No, I'm not. We're at 52, guys."
418.08,420.07,There's a lot of toys. I still don't
420.08,421.189,know what we're going to do with all
421.199,423.43,these toys. My plan is to donate all of
423.44,425.749,"these to kids that need it more. Oh,"
425.759,428.309,they're donating all of them. And we are
428.319,430.95,right here in front of Hope the Mission
430.96,433.43,"donation drop off center. Wait, guys."
433.44,435.909,"That's so sweet. A good job, baby. I'm"
435.919,438.27,so proud of you.
438.28,440.71,You This might have to move up. She
440.72,442.71,"might be in first place. I mean, that's"
442.72,445.189,so cute. I'm going to put Mila at number
445.199,447.51,one because you was so generous giving
447.52,449.35,all the toys to the Boys and Girls Club.
449.36,450.469,"So, I thought that was really sweet."
450.479,451.99,That was worth my money for sure. if
452.0,453.83,somebody goes on a Sephora hole. I know
453.84,456.23,Embry loves beauty products and that's
456.24,458.469,"really expensive. So, I just hope more"
458.479,460.95,YouTubers lean towards generosity rather
460.96,463.029,than craziness because I don't know if I
463.039,465.029,can handle more people bungee jumping
465.039,467.11,out of buildings or flying off of
467.12,472.35,"mountains. Now, it's a forly bungee"
472.36,475.83,"jumping. Hi. Off topic, her eyes and her"
475.84,479.189,hair are so pretty. Oh my gosh.
479.199,481.43,I need to plan some things out. color.
481.44,483.909,"Wait, where are you going? Follow me."
483.919,485.67,"First, I'm going to write down what I"
485.68,488.15,"would spend it on. Oh, snap. I like it."
488.16,493.029,"Number two, craft a fun surprise. We"
493.039,494.95,could like set up a party for all the
494.96,496.15,"cousins. Wait, why'd you write"
496.16,498.39,"pepperoni? A pizza party? No, I like"
498.4,500.71,plain pepperoni just to eat. We did a
500.72,502.629,video once and she has such good energy
502.639,504.55,and she's so sweet. Okay. All right. You
504.56,507.029,ready to roll? Yeah. Are we going first?
507.039,509.029,"Target. Kindly, look at this split. We"
509.039,510.309,couldn't have done the shopping spree
510.319,512.23,without Kenley. They're a good combo.
512.24,514.149,"You needed a luggage for your doll, too."
514.159,516.79,"Oh, I love these."
516.8,519.509,Sold to the girl with the purple pants.
519.519,522.149,Five stars. Six stars. They're having a
522.159,523.909,shopping spree with their dad. That's
523.919,525.59,fun when you're young. Is that still
525.6,526.949,"fun? That was fun with me. No, it's so"
526.959,528.15,"fun. Okay, I guess you don't want to go"
528.16,529.35,shopping sprees with me and my credit
529.36,531.269,card anymore. I guess that's fine. Looks
531.279,534.15,"like we got a duo, ladies and gentlemen."
534.16,536.87,"Tiny glass cup. Oh, that is so perfect."
536.88,540.389,"This is so much fun. Oh,"
540.399,543.35,I think you should get 39. 39. That's
543.36,545.75,good. I'm so tempted to get a ice cream
545.76,548.71,"truck. Look at all that ice cream. Okay,"
548.72,550.55,they're getting a lot of different
550.56,552.55,stuff. There's a big variety of stuff.
552.56,554.949,We're getting ice cream. Thank you.
554.959,557.509,"Cheers. Oh, and they're getting ice"
557.519,559.59,cream baddies. How much money have we
559.6,563.03,"spent? To be exact, it's 163. Oh my"
563.04,565.19,goodness. Look at this dresser. That is
565.2,566.389,Should we grab one for both of our
566.399,568.07,dolls? How expensive are they? art.
568.08,569.75,"It's not that expensive. Okay, now"
569.76,571.269,they're at a craft store and I guess
571.279,572.71,they're going to make crafts. That
572.72,575.43,sounds like a good idea. The little pots
575.44,582.07,and pans and the silver. It's so cute.
582.08,583.99,"Okay, I think this is good. We could"
584.0,588.15,have Robux with some road ducks. Six. I
588.16,589.67,think that's six right there. How much
589.68,591.99,"are you doing in Robux? 1,000 for"
592.0,594.389,"everyone? Yeah. That's cool of you,"
594.399,597.67,"dude. How much is 1,000 Robux?"
597.68,599.91,"No, you don't game. Me either. What?"
599.92,602.949,"200. Oh, 261. Just at the craft store."
602.959,607.19,We're probably going to have 383. 3057.
607.2,609.99,305. First part of our surprise is we
610.0,614.87,have pizza. Pizza.
614.88,618.069,3 2 1.
618.079,621.269,What's on the bottom? Robux.
621.279,626.389,"Robux. You guys, thousand Robux."
626.399,627.99,"They're so happy that they got 1,000"
628.0,630.15,"Robux. Now, I'm going to put Adley at"
630.16,632.71,number two because she was very generous
632.72,634.63,by giving some of the toys that she got
634.64,636.389,to her friends. She had a lot of fun
636.399,638.23,"getting the toys. So, that was sweet."
638.24,639.99,I'm keeping Neil at number one because
640.0,641.509,"she gave to charity, which is really"
641.519,643.03,hard to beat. This is just getting
643.04,645.11,started cuz other YouTubers are going
645.12,647.19,"nuts with the money. Okay guys, now it's"
647.2,650.23,"age 11, Mike Nostia. Hi guys. Yesterday"
650.24,652.63,I lost my hamster. You might have seen
652.64,656.55,them in a lot of my videos.
656.56,658.31,Thank you very very much. Have you seen
658.32,659.829,how many subscribers she has? I think
659.839,661.99,it's like 350 million. No. Have you seen
663.6,665.35,"I know it's crazy, right? For real. For"
665.36,667.269,real. I loved her so much. I'm going to
667.279,669.509,"PetSmart to buy a hamster. Guys, she's"
669.519,671.59,getting hamsters. That's so cute. I
671.6,673.67,found the hamsters. Look at this one.
673.68,675.59,"There's three. Should I buy three, guys?"
675.6,677.59,"So, we're getting this one, a Siri, and"
677.6,680.63,two. Just a white one. All right. Thank
680.64,683.43,you. You're welcome.
683.44,686.23,"So, I got my hamster. Now, let's go to"
686.24,689.59,the mall. Let's buy something for Salish
689.6,692.069,and Jordan. I'm getting her this lip
692.079,693.99,"gloss. Maybe she has it, but oh well,"
694.0,695.75,"she's going to have to. So, now stuff"
695.76,697.91,"for Jordan. Oh, perfect. His eyes are"
697.92,700.389,always looking a little too old. For
700.399,702.389,"real. My dad does look too old. Dad, you"
702.399,704.47,need some eye patches. And this reduces
704.48,706.069,redness. I don't think this is going to
706.079,708.23,"help because his face is always red, but"
708.24,710.63,let him give it a try or something.
710.64,713.59,"Okay, I have one more thing for Jordan."
713.6,715.509,I don't think he can ride a skateboard.
715.519,717.99,He's like 99. You know how Jordan always
718.0,720.55,"wears the boring black shirt? Well,"
720.56,722.63,"we're going to change that. Oh my gosh,"
722.64,725.59,that makes sense now. Perfect. Thank you
725.6,727.75,"so much. So, like a week ago, I came"
727.76,729.75,home from school. I have a package and
729.76,731.99,"there was like a really cool shirt, but"
732.0,735.389,"now I know it was Nia. Oh, that's"
735.399,738.31,"why. Oh, she bought that for me with my"
738.32,740.389,"money. Yeah. How nice of her. Yo, do you"
740.399,741.91,want to give me my noodles back? I'm
741.92,743.59,hungry. I'll go get your noodles. You
745.36,747.35,I learned he's not very talkative. I
747.36,749.19,bought everything I need and I spended
749.2,751.03,"all my money. Thank you, Jordan and"
751.04,754.19,Salish. Bye. Now I'm going to put
754.2,756.629,Nostia. I don't know. She's kind of tied
756.639,758.949,with Ocean. She got stuff for me and
758.959,761.19,from my dad and she made a lot of old
761.2,762.71,jokes which were really funny. I think
762.72,764.629,she's going to go over here at three. I
764.639,766.069,don't know. Ocean was really cute
766.079,767.99,"though. Okay, now it's Paisley from Not"
768.0,770.23,"Enough Nelson's and she's 13. Hey sis,"
770.24,771.509,it's me Paisley from Not Enough
771.519,772.949,"Nelson's. So, I want to go bungee"
772.959,774.069,"jumping. I've never been before, but"
774.079,775.59,it's also my sister Presley's birthday.
775.6,776.949,She's never been and she's scared of
776.959,779.35,"heights. So, let's go ask her. Presley"
779.36,780.949,"doesn't like heights. So, let's see how"
780.959,783.03,"this goes. Also, that's very generous"
783.04,784.79,that she's bringing her sister. Here's
784.8,786.11,your noodles.
786.12,788.79,Yay. Thank you. They're cold and they're
788.8,791.269,"like how appealing, guys. Okay. A couple"
791.279,793.59,"days ago, I came home from gymnastics. I"
793.6,795.829,ordered a ton. And I go upstairs and I'm
795.839,797.829,bringing my dad his like you know I'm a
797.839,799.35,nice kid. I was like saying like dad
799.36,800.79,your stuff is here. Came back into my
800.8,802.629,room and I was only holding mine like
802.639,804.79,that and I dropped it and it went face
804.8,807.03,plant on my floor. So I ate it but I was
807.04,808.629,eating it off the floor. You didn't put
808.639,810.31,"a backup bowl or anything. You just No,"
810.32,811.99,"I just ate it off the floor. Guys, I'm"
812.0,814.87,not gross. I'm really like not gross.
814.88,818.23,Who would eat off the floor? Dad. Yeah.
818.24,824.87,Come here. Try a pasta I made.
824.88,827.43,"Yum. Hey, Presley. I want to go to"
827.44,829.35,Vegas. Do you want to come with me cuz
829.36,830.949,"it's like your room? All right, guys. We"
830.959,833.59,"got my mom and Cass to bring us. Wait,"
833.6,834.79,Presley. Do you see how tall that
834.8,836.47,"building is? Oh, yeah. That's really"
836.48,840.069,"tall. Yeah. Yeah, that is pretty tall."
840.079,841.99,"Wait, guys. How far are we from Utah's"
842.0,843.509,"Vegas? It's like a couple hours. Yeah,"
843.519,845.11,but a couple hours just to go bungee
845.12,847.189,"jumping. That's crazy dedication. So, I"
847.199,848.23,got you a little present for your
848.24,849.189,"birthday. So, you have to get"
849.199,851.189,"blindfolded to see it. Okay. Okay, guys."
851.199,853.829,She's getting blindfolded.
853.839,855.35,How would you feel doing this deck? Oh
855.36,857.189,my gosh. I want to do this so bad. Have
857.199,860.79,you ever been budgy jumping?
860.8,863.91,"For real. Me, too."
863.92,865.99,Oh my gosh. Oh my gosh. Oh my gosh. I'm
866.0,867.11,"going to show you what we're doing, but"
867.12,869.43,you can't freak out. Okay.
871.199,873.189,"Oh my gosh, guys. She looks really"
873.199,874.949,scared. I don't think she wants to do it
874.959,876.79,very much. This is my idea. I'm kind of
876.8,879.11,scared now. This is weird. Are these
879.12,881.43,objects like sway? Like is this the new
881.44,884.55,pile? Yep. I'm excited. Scared. They're
884.56,887.509,going to jump all the way from up there
887.519,889.03,all the way to here. They're literally
889.04,890.79,walking out towards the edge right now.
890.8,893.99,"Guys, that's such a far drop. Mr."
894.0,898.35,"Security Man, block"
898.36,900.87,"him. By the way, everyone's looking me."
900.88,902.55,I'm not eating this very well. But how
902.56,904.15,the heck am I supposed to eat this
905.8,908.47,"Like, whatever. Anyway, so let's keep"
908.48,909.509,"watching. All right, Presley, how are"
909.519,911.43,"you feeling tonight? Scared. Bailey, I"
911.44,914.23,"think is having Presley jump first. Two,"
914.24,919.75,"one, go."
919.76,923.629,Oh my
923.639,926.31,gosh. Oh my gosh. That was not what I
926.32,929.269,was expecting. You faced your fear. That
929.279,931.03,"was a lot funner than I was expecting,"
931.04,933.35,guys. That looks so fun. I want to do
933.36,935.43,that. I want to know what's in that. How
935.44,936.55,long does it take to drive from
936.56,939.75,California to Vegas? 3 hoursish to
939.76,941.43,"drive. Yeah, it's not far. Hey, Dad."
941.44,943.11,We're going to Vegas tomorrow. Okay.
943.12,945.03,Okay. To bungee jump. Yep. I'm not sure
945.04,946.389,"if I'm ready for that. Oh, well that"
950.24,951.91,"That would hurt. All right, Paisley, you"
951.92,954.949,are recording jump. It's Paisley's turn.
954.959,962.629,"Two, one, go."
962.639,964.55,"Good job, you guys. Thank you, Jordan,"
964.56,966.71,"for giving us that experience. Paisley,"
966.72,968.31,I think I'm going to put her three
968.32,970.79,because she was generous about helping
970.8,973.03,Presley get over her fear about heights.
973.04,975.59,And then I'll put Nostia at number four
975.6,977.509,"and Ocean at number five. I'm sorry,"
977.519,979.03,Ocean. Hold on. Hold on. Wait. Why can't
979.04,980.79,"Paisley be at two or one? I mean, she"
980.8,982.629,helped her sister conquer a fear.
982.639,984.629,Because they gave stuff to each other.
984.639,986.23,"That was like sweet, you know? You think"
986.24,987.269,toys are more important than
987.279,989.03,experiences? I think that Paisley should
989.04,991.749,"be number two. No, I think yes, but"
991.759,994.31,Adley went out with her friends and got
994.32,996.31,stuff with each other and like had fun
996.32,998.31,"with her friends, but Paisley was with"
998.32,999.99,"her sister, you know? Huh? It's just"
1000.0,1001.749,"different. If you think that was bad,"
1001.759,1003.35,wait until you see the rest of the
1003.36,1005.43,YouTubers. The Norris Nuts have a bunch
1005.44,1007.59,"of kids, so they could end up spending a"
1007.6,1009.55,lot of my money. Now
1009.56,1012.15,it's 14. I know exactly what I want to
1012.16,1014.069,spend it on. Paragliding. And the reason
1014.079,1015.189,I wanted to do this is because I'm
1015.199,1017.11,"coming to an end of my vacation and Oh,"
1017.12,1018.949,"so like I get to go too, right? We're"
1018.959,1020.79,"both using this together. Oh, and Gigi's"
1020.8,1022.23,"there. Of course, they're going parrot"
1022.24,1024.15,"lighting. Uh, guys, no, you're not."
1024.16,1025.429,"Wait. Yeah. No, no. Sorry. You can you"
1025.439,1027.35,"can go. GG's also going to needle, I"
1027.36,1029.829,"guess, which is fun. Sibling bonding. I"
1029.839,1031.11,"would have invited you to come with me,"
1031.12,1032.549,"but you're too much of a chicken, so"
1032.559,1034.87,"that's why I didn't. Hey, Needle. I"
1034.88,1037.11,would so go there. He just called me a
1037.12,1038.63,"chicken. That's me. Okay, guys. We just"
1038.64,1040.23,jumped off right now and honestly I was
1040.24,1041.909,like terrified at first but now that
1041.919,1043.59,we're up here it's actually super chill
1043.6,1045.59,and the ocean view is insane. I think
1045.6,1049.789,the doll's about to jump off
1049.799,1052.71,"soon guys. Oh my god, we just did it. Oh"
1052.72,1053.909,"my god, guys. We're so high up in the"
1053.919,1055.669,"air right now. Guys, look at this view."
1055.679,1057.75,It's absolutely crazy. Next time we
1057.76,1060.23,"should do this together. Sish, that view"
1060.24,1062.15,"is so good. Yeah, Sish, if you were with"
1062.16,1063.27,"me right now, you would have definitely"
1063.28,1065.029,bailed out cuz this is way too scary for
1065.039,1067.11,"you. Hey Needle, I would not have bailed"
1067.12,1069.11,"out. I would have gone on that. Guys, I"
1069.12,1070.549,"don't I'm lost of words right now. Like,"
1070.559,1072.71,this is so pretty. Unlike anything I've
1072.72,1073.99,ever done before. This is crazy. I don't
1074.0,1075.59,know where Gigi went to be honest. She
1075.6,1078.73,just she just flew away and disappeared.
1085.36,1087.11,I'm trying to reach and grab the top of
1087.12,1088.63,"the box and see what's inside, but this"
1088.64,1089.669,isn't long enough. I got to find
1089.679,1091.11,"something longer. Guys, I'm going rate"
1091.12,1092.63,this experience a 10 out of 10. Thank
1092.64,1094.909,"you, sis. Guys, we're landing right"
1094.919,1099.35,now. Very good. We landed. Cool. I'm
1099.36,1101.11,"safe. You heard that, guys? I'm safe. I"
1101.12,1101.83,thought I was going to die on the
1101.84,1103.35,landing right there. Yeah. I thought he
1103.36,1104.71,"was going to die, too. Now I'm going to"
1104.72,1106.549,"put Needle. Rough picture, by the way."
1106.559,1107.75,Needle. You could have picked any
1107.76,1109.19,"picture. That was your best one. Uh,"
1109.2,1110.549,"Sail, you picked that picture. Oh, I"
