start_time,end_time,text
1241.2,1243.59,much fortnite 11 players remaining boys
1243.6,1244.909,all right I'm getting in a car there's a
1244.919,1246.43,guy down here I'm going to start raming
1246.44,1248.029,I can't really contribute much else feel
1248.039,1249.75,like this just build over here hey
1249.76,1251.07,what's going on oh there's three of them
1251.08,1255.07,in here oh God wait oh my God
1256.799,1259.35,200 oh my God
1259.36,1262.43,oh I'm in storm somehow oh oh
1262.44,1264.549,I'm dead I can't get my car out I tried
1264.559,1266.27,I tried to help I'm
1266.28,1269.19,dead oh my God Alex is dead lud's got to
1269.2,1270.909,do this himself Luda was the final
1270.919,1272.87,player remaining I personally think he
1272.88,1275.269,kind of sucks despite being a pro player
1275.279,1277.07,but he had a chance to prove me wrong
1277.08,1280.47,and clutch up come on he's he's got no
1280.48,1283.07,MCH now he just he just got all the wood
1283.08,1285.99,never mind he's still M three builds
1287.159,1289.99,builds no
1290.0,1292.07,you are not washed up you are not
1292.08,1293.99,overrated don't listen to anyone whoever
1294.0,1296.19,says that on God you guys made me so
1296.2,1299.31,nervous bro what the was
1299.32,1301.99,that that was only a 12% game somehow I
1302.0,1303.71,don't know okay this is going to be
1303.72,1305.99,Alex's last game if we win this game we
1306.0,1307.909,could get unreal this could be our final
1307.919,1310.35,game boys it's been an honor the laser
1310.36,1311.99,Esports team is off to a great start
1312.0,1313.51,you've put on a great show Proud member
1313.52,1315.63,of laser here would this be our last
1315.64,1319.39,game no no we died hell bro
1319.4,1322.549,oh that's heartbreaking 89% yeah let's
1322.559,1324.269,go play triers let go play triers all
1324.279,1326.43,right goodbye Alex he has to leave all
1326.44,1328.149,right good luck later bro it wasn't
1328.159,1329.909,going to be the same without all four of
1329.919,1332.31,us for the final game he had to go
1332.32,1333.99,there's literally a gap where he should
1334.0,1337.75,be as well that's that is heartbreaking
1337.76,1340.39,all right let's do it for him one last
1340.4,1343.19,game he's bro my family is having a go
1343.2,1344.59,with me like they want me to play like I
1344.6,1346.909,need a play bro are you kidding are you
1346.919,1348.269,kidding all right leave leave quick
1348.279,1350.31,before bus Le all right that does add an
1350.32,1352.19,extra game to our counter but I'll
1352.2,1354.47,forgive it he's back he rose from the
1354.48,1357.269,dead let's do this one last game one
1358.88,1361.95,game we had won almost every single game
1361.96,1366.35,we just needed one more win to get
1366.36,1368.669,unreal got no scope with a pistol I just
1368.679,1370.07,got no scope with a pistol I'm crawling
1370.08,1372.149,to you L crawl in there I'll block him
1372.159,1374.909,with my body nice I knocked one I
1374.919,1377.11,knocked two I'm coming get off my dick
1377.12,1379.23,nice okay I took two out quick I'm
1381.0,1384.23,cracked dead you're all trash live in my
1384.24,1387.549,shadow I'm over this last game we
1387.559,1389.71,had done all of this in one sitting I
1389.72,1392.43,had been rebooted like 16 times I had
1392.44,1394.59,ingested more gamer Subs than the human
1394.6,1396.909,body should ever ingest I was more gamer
1396.919,1398.87,sus than man I don't think I've ever put
1398.88,1400.51,like so much into something in my life I
1400.52,1401.75,think this is the most committed I've
1401.76,1403.39,ever been to something I'm not going to
1403.4,1408.87,lie that's bad air Benders are coming
1408.88,1411.23,I'm actually dead I'm actually dead no
1411.24,1414.23,Ms Luna is dead but I am
1414.24,1418.63,not okay my car is
1420.4,1423.59,Lon lon's got some Aimbot it was clearly
1423.6,1425.35,not going to be a perfect game but we
1425.36,1427.99,didn't need it to be hell yeah let's go
1428.0,1430.07,let's go win the game top 25 we just
1430.08,1432.269,have to win so we could go to bed so we
1432.279,1433.99,could be done with this all right this
1434.0,1436.149,is the final
1436.159,1438.95,team oh I'm still in
1438.96,1440.75,get out of here all this hard work it's
1440.76,1442.87,about to pay off it's about to pay off
1442.88,1445.909,let's do it bro let's do
1445.919,1448.75,it dead one remaining for us to get
1448.76,1450.63,unreal I'm getting emotional I can't
1450.64,1453.269,believe it oh my God no I see him over
1453.279,1455.23,there let him one one let him one V one
1455.24,1457.149,him oh he's building a One V one give me
1457.159,1458.47,some give me everything I need Max
1458.48,1461.07,Health get me get me Max this final guy
1461.08,1462.789,wants to One V one me just so be clear
1462.799,1465.75,if he kills me uh destroy him it doesn't
1465.76,1467.909,matter how many kills we get we had to
1467.919,1470.11,win the game if we wanted to rank up to
1470.12,1473.75,Unreal oh it's about to go down oh
1473.76,1475.95,my God this entire speedrun this entire
1475.96,1479.51,game had come down to this one V one oh
1479.52,1481.35,my god oh oh
1481.36,1489.909,nice be crack let's
1489.919,1494.269,go yes wait for
1494.279,1496.71,it yeah
1496.72,1500.35,un yes boys 10 straight hours of
1500.36,1505.35,fortnite 25 games 21 wins 956 total
1505.36,1508.43,kills 17 reboots
1508.44,1512.12,oh unreal
