start_time,end_time,text
1210.0,1213.95,in p p across the barge I'm left
1213.96,1215.75,thinking in a place like transnistria
1215.76,1218.07,it's easy to focus on war Soviet history
1218.08,1219.71,and guys with big guns but there's
1219.72,1221.47,another side to this story one that
1221.48,1223.549,often goes unnoticed the vital role of
1223.559,1225.789,the Babushka in Russian Babushka means
1225.799,1227.669,grandmother but it can refer to any old
1227.679,1229.43,lady who is charming and hospitable I
1229.44,1230.99,can't wait to bring Diana and her mom to
1231.0,1232.43,meet some of these ladies and see how
1232.44,1238.63,they keep their old traditions
1238.64,1243.43,alive how are
1243.44,1247.75,you thank you for having us
1247.76,1250.71,here is she making
1250.72,1258.789,wine this is amazing
1258.799,1260.47,this is the toilet situation here in the
1260.48,1262.029,village here we
1262.039,1264.43,go wow it's actually better than I
1264.44,1265.87,thought it was going to be what do you
1265.88,1267.83,think about transnistria it's abundant
1267.84,1270.87,inal crops how about the people nice I
1270.88,1271.71,just want to take a minute and
1271.72,1274.19,appreciate how beautiful this Village is
1274.2,1276.029,we're surrounded by grape trees plum
1276.039,1279.51,trees apple trees corn they're so rich
1279.52,1281.87,in natural resources and food all right
1281.88,1282.87,we're going to go hang out with the
1282.88,1284.75,babushkas or the grandmothers as they
1284.76,1288.53,say in Russian and get their stories
1289.96,1293.669,walnuts yeah
1293.679,1297.269,yeah Tak walnuts okay I'll take a walnut
1297.279,1299.63,while I ask you some questions how do
1299.64,1302.149,you open
1302.159,1305.549,it strength
1305.559,1309.35,time thank you BBA what was it like
1309.36,1310.83,growing up here when you were younger
1310.84,1312.59,were there any struggles to living here
1312.6,1316.31,in Soviet times real communis we live it
1316.32,1318.75,in the communes but we didn't see like
1318.76,1321.95,communism yeah the prices was very low
1321.96,1326.31,like sausage cost two rubles and 20 CET
1326.32,1328.47,yeah like free free sausages for
1328.48,1331.31,everyone it was B time have you ever
1333.76,1337.35,outside she been all in Moscow and Minsk
1337.36,1341.75,for all her life fruits for just for
1341.76,1343.23,selling she never sorry she never
1343.24,1346.11,traveled there never so she's never left
1346.12,1348.669,transnistria never what do you wish that
1348.679,1350.19,you have in your life that you don't
1350.2,1352.99,have right
1353.0,1356.47,now I want just health and the god to
1356.48,1359.39,give me more some sometimes to leave and
1359.4,1362.07,to help kids there's a lot of Wars
1362.08,1365.029,happening really close to transnistria
1365.039,1366.63,is it something you think about does it
1366.64,1370.07,affect your life at
1370.08,1373.23,all well she talking about like if some
1373.24,1376.11,you know trainings and he can hear this
1376.12,1378.11,and of course she worrying about this
1379.08,1382.31,what do you think about the
1382.32,1387.71,us only bad only bad okay what's the key
1387.72,1390.149,to living a long happy healthy life cuz
1390.159,1394.549,you seem to be all of those
1394.559,1397.909,things all the kids like they coming at
1397.919,1400.95,me visit me and we working together and
1400.96,1403.39,I happy what do you think about Trump
1403.4,1408.71,and Putin
1408.72,1411.95,he's a leader and he's a strong leader
1411.96,1415.669,and he help people and protect them
1415.679,1417.909,about Trump well she can say nothing
1417.919,1420.35,about because she said like he's in the
1420.36,1424.909,United States and he doing business I
1424.919,1428.149,mean you're very beautiful and
1428.159,1431.47,hardworking and courageous so thank
1431.48,1434.31,you now I will do makeup also I like
1434.32,1438.669,your teeth they're beautiful
1438.679,1442.43,she wants both of them to sit on her
1442.44,1444.43,legs she won't let us leave without
1444.44,1448.75,giving us more things she's so
1448.76,1451.83,friendly she's so so so kind this is the
1451.84,1453.07,kind of place that you could stay for
1453.08,1455.549,like days and days and days and she's
1455.559,1457.669,just going to take care of you she wants
1457.679,1460.549,to give a gift another one you'll get
1460.559,1462.35,tons of gifts here in The Villages this
1462.36,1464.789,is like the hospitality of the region
1464.799,1465.75,yeah and this is something that's
1465.76,1467.75,overlooked by everyone whatever they
1467.76,1469.87,grow themselves in the village you are
1469.88,1473.789,welcome to it how is it nice yeah so
1478.0,1480.47,juicy there are seeds in it us spoiled
1480.48,1482.43,Americans growing up never had seeds in
1482.44,1485.11,grapes we can't eat all those look at
1486.0,1487.95,that thank
1487.96,1491.87,you thank you before we came here my
1491.88,1494.47,mom's first impression I mean
1494.48,1496.789,thoughts they're aggressive and they're
1498.559,1503.59,but it's Japan change to reality oh yeah
1503.6,1506.07,so she said that the reality it's the
1506.08,1507.95,opposite of what she thought remember
1507.96,1509.269,when we at the airport you don't know
1509.279,1511.029,where we're going she said
1514.08,1516.43,yeah all right Tim there's not too many
1516.44,1518.549,Americans walking this land you've been
1518.559,1520.909,here for 17 years give me the spark
1520.919,1523.389,notes how did you end up in transnistria
1523.399,1525.59,after a few years of living in Poland I
1525.6,1527.789,found out that Maldova had dropped their
1527.799,1530.389,old Soviet Visa standards and I came
1530.399,1532.63,here by myself so I started working with
1532.64,1534.389,tourists and of course all local people
1534.399,1536.269,said no tourist will come here that's
1536.279,1537.95,silly they don't want to see the Soviet
1537.96,1540.23,stuff and I told them that's exactly why
1540.24,1541.71,they will come to be honest this is the
1541.72,1544.269,most fascinating slice of all of Europe
1544.279,1545.83,you literally feel like as close as you
1545.84,1547.789,can get to the actual Soviet Union we
1547.799,1550.07,are in the Town Center here of teraso
1550.08,1552.31,the biggest city in transnistria the
1552.32,1553.95,capital city and home of half the
1553.96,1556.389,"population about 150,000 people live"
1556.399,1558.95,here over here is a trans flag with a
1558.96,1560.59,Russian flag Russian flag's a little bit
1560.6,1562.149,higher and the rest are the regional
1562.159,1564.269,flags of transnistria the provinces and
1564.279,1565.95,over here are the only three
1565.96,1568.35,unrecognized countries that recognize
1568.36,1569.95,this unrecognized country that was a
1569.96,1572.63,confusing sentence you have stia and
1572.64,1575.11,abazia there used to be nag noach but
1575.12,1577.95,sadly that one doesn't exist anymore 34
1577.96,1580.51,how many years of existence transnistria
1580.52,1583.07,has been in I'm 33 so basically my whole
1583.08,1584.95,life they found this tank in the river
1584.96,1586.47,recently since there are not many rules
1586.48,1590.029,in transnistria I think we should CL it
1590.039,1593.87,yeah oh man this is so awesome what's
1593.88,1595.51,better than walking around traso
1595.52,1598.029,standing on a tank overlooking teras
1598.039,1599.789,it's the first time I've been in a tank
1599.799,1602.23,what do you think it's so cool how do
1602.24,1604.47,you feel about transn out oh my God it's
1604.48,1606.95,it's amazing so different not many
1606.96,1609.549,tourist right no everywhere you go in
1609.559,1611.63,transnistria you see cars like this it
1611.64,1613.029,looks like they can be taken out of here
1613.039,1615.149,and placed straight into a museum and
1615.159,1617.909,how much would this cost a month average
1617.919,1619.71,like $150 a
1619.72,1622.149,month I mean if you rent but like I said
1622.159,1624.149,most people don't rent only if they're a
1624.159,1625.99,student from outside of tesel most
1626.0,1627.75,people their family owns property
1627.76,1629.909,outright not the bank so all these
1629.919,1632.35,people around us they have cheap housing
1632.36,1633.95,what do the Bills look like how much you
1633.96,1636.35,pay every month literally like a regular
1636.36,1637.59,apartment your bills are going to be
1637.6,1640.31,like $30 a month and that includes uh
1640.32,1643.43,internet phone gas and electric and
1643.44,1646.549,water so $30 month a dollar a day for
1646.559,1648.43,all those things you found a dog can I
1648.44,1651.23,take a picture what's your name is Linda
1651.24,1652.549,Linda what's
1652.559,1661.149,up I I'll step back don't take a stick
1661.159,1664.909,showa he's telling her to set okay oh my
1664.919,1668.83,God okay I oh
1668.84,1673.35,wow wow very disciplined that dog freaks
1673.36,1675.63,me out of those teeth man
1675.64,1679.269,yeah wow okay thank you
1679.279,1683.19,she five years I so so nice to meet you
1683.2,1685.789,nice to meet you byebye bye bye very
1685.799,1687.63,nice people it's actually quite nice
1687.64,1689.389,this time of the year because the trees
1689.399,1691.83,are changing colors fall Autumn has
1691.84,1694.789,begun in the Parks when I was at home
1694.799,1696.909,when I went to a park or went for a walk
1696.919,1699.95,nobody Zombie Land and here look the
1699.96,1702.509,kids zooming around you parents the
1702.519,1704.23,parks and the sidewalks are full every
1704.24,1705.99,night this is precisely why it's called
1706.0,1708.11,Airplane Park you have a World War II
1708.12,1710.22,playing Just In the
1714.12,1716.23,Park after meeting some people on the
1716.24,1717.75,streets of terasol Tim wants to
1717.76,1719.23,introduce me to one of his friends who
1719.24,1721.509,collects old Soviet cameras I've had a
1721.519,1723.11,lot of fun getting my photo taken on
1723.12,1724.43,vintage cameras in places like
1724.44,1726.269,Afghanistan so I'm stoked to see what
1726.279,1729.47,this guy is hiding behind closed
1729.48,1731.669,doors it's cooler in there because you
1731.679,1733.11,notice how thick these walls are they're
1733.12,1735.43,made from sod he made everything yeah
1735.44,1738.789,yeah this is my bedroom bedroom yes this
1738.799,1739.99,is my
1740.0,1745.35,guitar good
1745.36,1747.83,English can you tell him that he has the
1747.84,1750.23,best eyebrows I've ever seen you have
1750.24,1762.75,great eyebrows
1764.919,1767.509,wa that's so that's way nicer than the
1767.519,1775.789,babushka toilet all
1775.799,1783.99,right it's the time of year for
1784.0,1786.83,n wow
1790.08,1793.149,yeah fake
1793.159,1797.029,rock Biz Platinum didn't cost anything
1797.039,1799.789,free villes here just goes to show that
1799.799,1801.029,anywhere you are in the world when you
1801.039,1802.63,get out of the cities and when you go
1802.64,1804.669,into the rural places people are so
1804.679,1806.87,incredibly friendly and that's really
1806.88,1809.149,one of the morals of this story is that
1809.159,1811.23,people are happy here they live normal
1811.24,1813.31,lives there's all kind of crazy messed
1813.32,1815.19,up politics going on both here and
1815.2,1816.909,around the region but at the end of the
1816.919,1818.95,day people are just people they just
1818.96,1820.47,have the same wants and needs as me and
1820.48,1821.99,you and they want to just enjoy their
1822.0,1823.63,lives and that's been a really
1823.64,1825.71,reassuring thing to experience here in
1825.72,1827.549,transnistria after traveling to every
1827.559,1829.31,single country in the world and in
1829.32,1830.95,Europe I actually feel connection with
1839.48,1845.31,wow he wants to turn it into a giant
1845.32,1848.23,Museum the quality will be much better
1848.24,1851.509,than digital what so
1851.519,1856.909,big wow why does he have
1856.919,1859.11,that it the most random thing he
1859.12,1862.71,possibly could have pulled out daugh
1862.72,1867.95,like all the
1867.96,1871.149,to now goes back in the bag back in the
1871.159,1874.669,bag oh what's in the box
1874.679,1876.87,oh at all
1876.88,1879.95,this oh my God yeah that's in a lot of
1879.96,1882.029,movies a lot of the old school
1882.039,1884.389,independent directors they started their
1884.399,1887.07,careers using this old 8mm film wow
1887.08,1888.509,that's so cool
1888.519,1896.269,that's so
1898.0,1900.909,1950s projector what I'm surprised by is
1900.919,1902.71,how small it is for
1902.72,1904.95,1950s very
1904.96,1909.35,small wow 100y old
1909.36,1912.59,projector pooid oh wow that is one of
1912.6,1916.549,the first Polaroid cameras ever made wow
1916.559,1918.43,problem with all these old Camas
1918.44,1920.83,is you can't find the film for them and
1920.84,1922.31,also the battery you can't find the
1922.32,1924.509,battery somehow he got his hands on an
1924.519,1926.269,old American photo booth here in trans
1926.279,1928.509,anista I I have no idea how this
1928.519,1929.789,happened you'd be surprised what you can
1929.799,1932.629,find out here yeah yeah uh he wants to
1934.919,1937.629,uh come what is the best and the worst
1937.639,1941.83,part about living in
1941.84,1943.669,transnistria yeah he said like it's a
1943.679,1946.509,black soil and everything green I mean
1946.519,1948.95,you can grow everything yeah and uh
1948.96,1950.549,that's what he likes yeah is there
1950.559,1954.549,anything you don't like about living
1954.559,1957.71,here we need to change people that's in
1957.72,1961.669,government and will'll be everything
1961.679,1964.509,perfect we made it to a cool hit part of
1964.519,1968.59,teraso cafes bars you like it here mhm
1968.6,1970.35,so cool we were just talking about how
1970.36,1972.47,chill it is here it's just like a cool
1972.48,1973.629,place I don't know how to explain it
1973.639,1975.509,everyone's just hanging out before this
1975.519,1977.23,trip you don't know anything what do you
1977.24,1980.07,think now before I have the
1980.08,1982.629,awward and now description now it
1982.639,1984.47,changed you have a different thought
1984.48,1986.19,Bish away the
1986.2,1989.669,award description you come in with one
1989.679,1991.669,perception of how a placees and then you
1991.679,1993.35,realize that wow it's actually like
1993.36,1994.75,really cool here's the thing about
1994.76,1996.669,transnistria it might not be recognized
1996.679,1998.629,by the world but its story is impossible
1998.639,2000.47,to ignore from the Soviet Flags to the
2000.48,2002.31,war torn bunkers to the Babushka still
2002.32,2003.87,holding on to their traditions this
2003.88,2005.83,place truly is a time capsule but
2005.84,2007.59,despite being trapped in political limbo
2007.6,2009.43,the people here have found a way to live
2009.44,2011.23,to remember and to make the most of what
2011.24,2013.029,they've got at the end of the day it's
2013.039,2015.11,the uniquely Eastern European spirit
2015.12,2017.19,that defines transnistria so even though
2017.2,2018.87,only a few hundred people get to visit
2018.88,2020.389,each year what I've learned is that it's
2020.399,2022.029,often the most forgotten places that
2022.039,2023.75,have the most to teach us thanks for
2023.76,2025.269,watching and I'll see you in the next
